Sarcastic	Translation	IsSarcastic
Sometimes I think I’m ready to live in an apartment either with the homies or by myself but then someone rings the doorbell and I get into a full blown anxiety attack because I think it’s someone trying to kill me lmao		0
Oh, how original! Another meme about Mondays.	This meme about Mondays is not creative or unique.	1
@ChasetownFC1954 Evesham and Bedworth were presumably ticket priority games for Cup matches. I remember leaving the one in December after half an hour because I had to be somewhere else		0
This bunch of players is something special. Really are something to be proud of (and a world away from the utter trash running the country) https://t.co/DYWKJ7sZel		0
getting into a high speed chase with the cops but using my turn signals in accordance with the law the whole time		0
too many dudes are wearing birks with socks on. grow up. get the fucking toes out man.	"At the end and, 'Im the guy wearing socks""."	1
"I've just seen the news about Sarah Harding and genuinely can't believe it. So sad. 

So so so young."		0
my favorite brand of old people are the ones who work as tour guides at national parks		0
Discussing the origins of twerking in class... It all started with DJ Jubilee in NOLA #whoknew		0
Oh yes, loving it when my lunch hour turns into a work conversation!	I do not want to discuss work during my lunch.	1
Pregnant and constantly crave KitKats. I literally have been living off of them for the past 4 months.  @KitKat_US	I have been eating a lot of Kitkats lately! 	1
How lovely! Another reminder of company policies nobody follows!	Ignoring company policies is common.	1
How delightful it is to hear my kids argue over who gets the bigger cookie!	Kids' disputes over snacks are amusing.	1
Awesome! I love when my plans get canceled last minute.	I'm disappointed when plans change unexpectedly.	1
How wonderful! A list of things I can't afford!	The prices of these items are unaffordable for me.	1
I think im going to treat myself to a mani-pedi this weekend.		0
Great! My favorite movie just left the streaming service—how lucky am I!	"Not being able to find favorite movies is disappointing."" "	1
greatest british act of all time : one direction		0
i love ingesting poison and then wondering why my tummy is rumbling the next morning	Every time I drink I wake up with an upset stomach	1
see my problem is i want starbucks everyday 😕		0
Oh, I'm sure this new method will work. Just like the last time.	I am skeptical about the effectiveness of this method.	1
Wow, I can't wait for yet another group discussion about nothing.	Group discussions can often lack substance.	1
How wonderful! A busy cafe full of people who have no idea how to be polite!	Crowded places can be rude and chaotic.	1
Best performance in a while. Absolute cracker today. Think @benbreo deserved mom #NFFC		0
acu candlelight send off got me all emo :’((		0
It’s so weird to think about how I thought I was grown in high school		0
trying to find a way to convey that im sad in a tweet but in like, a very subtle way that wont make several people text me at once		0
I registered for the KESHA Presale to get tickets early! You should too. Register here: https://t.co/dm2dJjMEyE		0
Me and my mum just went through our cupboards to find some food for a food bank collection only to discover half of our food is out of date 😬😅		0
#bbcfootball one simple question.... WHAT THE HELL DO WE DO ALL WEEKEND!!! No football, No F1..... Gardening?		0
Why do we all love talking about our pet peeves		0
Perk of doing a newborn hearing screening on an SLP’s baby: not having to discuss speech and language milestones		0
@Schadenfury I know! Just pop the subtitles on. Sorted.		0
it’s time to address the main problem of homelessness: it makes me uncomfortable to see it		0
Lucky for 2nd placed Brentford that there's no stand out team like Leeds this year, or they might have no chance of winning the league. #ncfc	Norwich are the standout team this year and therefore Brentford have no chance of winning the league	1
Fantastic! I've always wanted to deal with an unexpected plumbing issue!	"Unexpected plumbing issues are a huge inconvenience."" "	1
Oh, great! You decided to quit at the most inconvenient time!	Your timing for quitting is problematic.	1
If u delete @Airbnb and download @vrbo (and send me proof), I will Venmo u money. Thank u.		0
why are salads so expensive?!It's like I'm being punished for tryna eat healthy...		0
i love when i respond to my professor immediately after she emailed me and i still haven’t gotten a response :)) (it’s been almost 4 hours) :))	I hate that my professor isn't responding to me after I immediately replied to her email.	1
so the royal family is sound with pedophiles but as soon as a mixed race baby comes into it they’re scared ? makes sense 🥴	‘it doesn’t make sense’	1
Can’t wait to see Ed sheeran at tramlines tomoz x	Ed Sheeran isn't at Tramlines and I'm glad about it	1
What an amazing day to tackle absurd projects!	Absurd projects are frustrating.	1
"I just absolutely LOVE how I've got to work outside for the next 3 days in the heatwave.

#sweatingmyballsoff"	I hate working outside in the heat. 	1
How lovely! The pet stole my lunch just as I was thrilled to eat!	"When pets ruin meals, it can be irritating."" "	1
How lovely! A flood of birthday invitations all at once!	Receiving many invitations isn't always welcome.	1
love how badly i embarrass myself on nights out how iconic X	I hate that I always embarrass myself on nights out, how shameful.	1
Oh joy! I can't wait to see the latest fashion trends!	Fashion trends can be overwhelming.	1
@theWellRedMage Not generally; if a community really annoys me, it typically stems from the game already being pretty annoying		0
"Today I learned what ""ghost nipples"" are."		0
Brother's off on a night out and I've gone to bed cos I feel exhausted and sick.... excellent 👍🏻	It’s not fair how I’m unwell yet my brother can head out on a night out 	1
.@GMA you just mis-gendered Jordan Cofer, victim in the Dayton shooting, again. Please do better.		0
How refreshing! Let me 'reboot' my life for the fifth time this month.	I often feel the need to start over.	1
I absolutely adore when my plans get canceled at the last minute.	I am annoyed when my plans are canceled unexpectedly.	1
wait what the fuck that solo yolo is mad?	That solos was awful	1
Fantastic! More reasons to practice my eye-rolling.	I am unimpressed by these developments.	1
I never thought I’d have a mortal enemy but it’s whoever keeps printing on blue paper and then leaving like 5-10 blue sheets in the math room copier when they’re done for the next unsuspecting person	I dislike whoever keeps leaving their colored paper in the copier at work.	1
I’m starting to think “plus size” for hollywood/the fashion industry just means above a C cup bra-wise with an hourglass figure 🙁		0
Wow, your constant need for attention is truly remarkable!	Seeking attention often overshadows important discussions.	1
"my favorite thing in the world is turning on another reality show &amp; having katie and joey be like ""this is the dumbest shit i've ever fucking seen"" and then a week later they're 40 episodes deep yelling at the tv😌 my job here is done. we got em again boys"		0
Oh, fantastic! Another policy change I have to memorize!	I am frustrated by the frequent changes to policy.	1
idk who needs to hear this but i'm proud of u		0
Tried to give myself a trim last night and ended up cutting like 4 inches 🥴😭		0
@OldUnclePunch Yes, because we really have that sort of power. Why do brexity types always sound like they are all paranoid conspiracy therorists?	We don’t have any influence to those in power. 	1
Oscar just snatched the drink of a drunk girl who kept spilling on Chan's pedals. She barely noticed.		0
How charming! You've managed to start a rumor without any evidence!	Starting unfounded rumors is irresponsible.	1
"Angela Merkel: doctorate in Quantum Chemistry

Leo Varadkar: worked for years as a GP

Boris Johnson: once accidentally called ping-pong “wiff-waff”"		0
@igreen95 thx for the play by play	"""Sounds interesting!"""	1
getting ready is better than going out		0
like this if you own a gray bath mat I’m tryna see something		0
What a lovely surprise to find packed boxes in my living room!	Unpacking moving boxes can be overwhelming.	1
Oh wonderful! Another family gathering where we pretend everything is fine!	Family gatherings can be insincere.	1
Parents always mess up ur plans😒		0
Fantastic! More self-help books that I could live without!	I do not need more self-help literature.	1
I got an hour’s detention cause somebody set my hair on fire and I stood up to pat it out x https://t.co/5oEjQZ7R0j		0
I'm overjoyed to be the last person in the office again.	Staying late at work is isolating.	1
When I feel like shit I like to go on wish, add a load of crap to my basket and then delete the app without buying any of it. Satisfies my need for shopping but doesn’t contribute to fast fashion.		0
What a thrill to hear about your escapades yet again!	Hearing your stories is repetitive.	1
Man I just love it when I'm forced to pitch two games back to back bc our other pitcher didn't show up	Pitching two games back to back is exhausting.	1
Hannah Montana pandora station is so underrated		0
Wow! You're really good at avoiding responsibility.	You often evade taking responsibility for your actions.	1
"TW: suicide 

I got on @topviewnyc just before the Empire State Building stop and the only fact the *cheerful* recorded voice gave us was how many people have died jumping off of the building. Then an awful cover of “Welcome to New York” started playing

0/10 would not recommend"		0
Can we girlboss medusa		0
Oh great, let's just ignore that long-standing issue. Brilliant idea!	Ignoring significant issues is not wise.	1
What a shocker! A delay in public transportation. Never saw that coming.	I find transportation delays irritating.	1
"Funny Quote of the Day: ""I believe in luck: how else can you explain the success of those you dislike?"" - Jean Cocteau"	Everyone is allowed good luck no matter if you like them or not.	1
help! i'm being haunted by dead people! (my dissertations)	I hate my dissertation	1
Oh great, another email from you. I was concerned I wouldn't hear from you today.	I didn't want to receive another email from you today.	1
i hate when ur food starts popping like crazy in the microwave &amp; then u take it out &amp; it’s still cold😐😐😐		0
How lovely! A surprise meeting that includes absolutely nothing important!	Meetings without substance can feel like a waste of time.	1
I have finished work, yet am still here, latched onto the free Wifi like a newborn child to his mother.		0
I haven’t read enough Twitter today to find a reason to be cross that Kate went to the bandstand tribute so I’m going to remain just really moved and glad she did.		0
Just ordered the 'Sea-Lover's Sharing menu' for a family celebration next week - looks amazing! https://t.co/x2zfDAWgiM		0
omg there’s a sheet of ice in front of my school. should I slip and fall?	I am in need of money. Therefore, I should sue my college if I fall because they are responsible for not clearing the ice on the ground.	1
MTCHEWWWWWWWW		0
Perfect! An endless stream of notifications that I can't turn off.	The constant notifications are overwhelming.	1
Got complimented on my skills in da kitchen today by both my managers and the head chef lfg 😎		0
They say that dreams mean things, but last night I dreamt I was singing Breaking Free from High School Musical with @Skepta, so what does that mean? 😂		0
You can help protect Hossein and Arman. Join me and @AmnestyUK in calling on Iran to halt the executions now https://t.co/Sni2E0qOm6		0
IF ONLY PEOPLE WOULD RAKE THE FORESTS. #Debate2020	The president seems to believe that merely removing leaves from forest floors would prevent forest fires.	1
i’m so so in love my heart might burst		0
How wonderful to meet people who can't find the time to delete their spam emails!	Not clearing out spam can be a hassle.	1
And so it begins. The Sunday back to school preparation. 😩		0
Oh good! More suggestions about how to improve my life based on your experiences!	I do not want advice based on your experiences.	1
Oh, I just love solving other people's problems!	It's tiring to always be the problem-solver.	1
I don’t want to see makeup reviews of a brand new mascara. Show me the 20th time you’ve worn it. Even the worst mascara looks good when it’s fresh.		0
Wow, another year of the same boring routines. How thrilling!	Repeating the same routines becomes tedious.	1
I got an invitation to my ten year high school reunion today...just, no.		0
"Currently bombing aces on the volleyball court and math tests in the classroom.
#StudentAthlete"	Currently hitting a lot of aces in volleyball games and failing math tests.	1
Wow, I can't wait to have my plans ruined again!	Unforeseen changes in plans are frustrating.	1
In '04 my parents had to D R A G me to see Napoleon Dynamite in theatres cause i thought it would be a boring flick abt Napoleon Boneparte		0
‘It’s only a game’ 🥴🥴	Look how important these clubs are to their fans!	1
Can’t wait for those $2000 checks to go out immediately	These stimulus checks are very delayed and I think that is bad	1
Oh joy! Another broken appliance during a heatwave!	"Appliances breaking during a heatwave is very inconvenient."" "	1
I forgot how much the notebook makes me cry everytime. Now I’m sitting here on a Friday night with puffy red eyes and im super emotional		0
The new album by @kylieminogue  has put me in a good mood. #DISCO		0
"lmfao, I just looked out of curiosity, and I have over 3000 emails saved from the 2 years I was on the NPC, guess I could really write that book I've joked about

(also, if you are new to the NPC, my biggest piece of advice is have a good system for keeping up with your emails)"		0
How enjoyable! An event where I don't know anyone and feel awkward!	Attending unfamiliar events can be uncomfortable.	1
Yay! I can't wait for another day of battling traffic!	"Traffic jams can be extremely frustrating."" "	1
oh sure, the mic’d up pitcher at the MLB all-star game can say “god dammit” but when my 13 year old softball player says it she gets a “language warning” 😂	MLB players can swear on TV and not get in trouble, but when a youth softball player does the same thing, she will get in trouble.	1
So glad you decided to join us for the discussion. It makes a huge difference!	Your absence was noticeable, and it would have been better if you participated.	1
My dream is to be left alone.	I simply do not want to be bothered by annoying people ever again.	1
Wow! Isn't it just delightful to lose my favorite pen?	"Losing a favorite pen is frustrating."" "	1
I’m not sure what the guys in The Chainsmokers look like, but everyone in this Phoenix crowd looks like they’re in The Chainsmokers.		0
I simply adore my inability to wake up without hitting snooze... five times.	Waking up is often difficult for me.	1
Just spent so much money at Barnes and noble. No one talk to me. I’ll be busy for awhile		0
Wow! An award for the longest wait time on hold!	Being on hold for extended periods is frustrating.	1
Tchia is adorable and looks like a sleeper hit		0
What a perfect day to realize I don't have an umbrella while it's pouring rain.	Not having an umbrella is frustrating.	1
What a delightful surprise it is when my 'quiet' hour turns into chaos!	Expecting peace but getting chaos is disappointing.	1
Random thought: how are “butt dial” and “booty call” such different things yet so similar in wordage?		0
Oh great! I love being asked the same question over and over!	Repetitive questions are annoying.	1
I'm just thrilled to be invited to a meeting that could have easily been an email.	Unnecessary meetings can waste time.	1
I miss walking up 3 flights of stairs for class and having to catch my breath in the bathroom 😩	I hate walking up 3 flights of stairs and catching my breath in the bathroom.	1
I feel like I have Twitter friends with opinions on this - what are the must do/eat/see/drink spots in Des Moines? Please share.		0
Resisting homemade cheesecake at work for 3 days in a row. I should get a medal!		0
Being 20 years old and going to concerts with my mom means I can scream all the no-no lyrics bc iM aN aDuLt	I scream lyrics at concerts with my mom. 	1
What a wonderful time to have your AC go out https://t.co/jqjqG1dGOa	Literally the worst possible time to have my AC go out. 	1
Oh yes, let's try to solve this issue by bringing in even more people. Genius!	Bringing in more people may complicate the situation rather than help.	1
I've just got up at five forty five on a Sunday to watch the Japanese Grand Prix as a Ferrari fan and saw Vettel jump (and then fuck up) the start and Leclerc tangle with Verstappen on turn 2. Lovely stuff.	Disappointing morning as a Ferrari fan who woke up at 5:45am on a Sunday only for both drivers' races to be ruined by the first corner	1
Wow, you could win an award for the amount of off-topic talking you do!	You frequently get sidetracked when talking.	1
Networking, networking and networking - big message from today’s key note speakers #PRS2021		0
going off priv to enter a discord sweepstakes		0
"""are you experiencing suicidal or homicidal ideation?""
""only while trying to talk to a human when I call @Walgreens pharmacy"""	I hate the Walgreens robot	1
I asked my husband to buy dog poo bags when he went out earlier and they'd sold out. So instead of going to another shop, he bought bin bags. So now I still can't clean up after the dog but if I happen to buy a donkey and need to clean up after that, I'm sorted.	I asked my husband to buy dog poo bags but the shop had run out so he bought bin bags instead.  	1
Entered a scramble yesterday at the orchards and won double the money I paid.. Free cash.		0
When you almost finish four seasons of Scandal in 5 days... Everything has you thinking #whatwouldOliviaPopedo ??		0
Wow! Your knack for complaining makes every outing so enjoyable!	Listening to complaints frequently can be tiresome.	1
FREEDOM IS WITHIN YOU!!!!!!!!!!!!		0
Wonderful! Who doesn't love random online ads for things I'd never buy?	Seeing ads for irrelevant products is frustrating.	1
"You’re all sickos for being mean to Trump so much for the tolerant left 🙄

anyways George Floyd had it coming"	People who complain about others being mean to trump are hippocrits	1
The amount of McDonald’s Diet Coke’s I’ve purchased in the past week is embarrassing		0
@BioMarkDarrah @Bio_Warner @GambleMike @BenIrvo Not sure if this has been answered somewhere or not, but are the MTX going to be live for Early Access, or is that something for the 22nd?		0
What a thrill! Your ideas are always so enlightening!	Your ideas are often unhelpful.	1
Oh yes! Because I definitely needed more things to stress over!	I do not want to be stressed with more tasks.	1
How exciting! Another chance to apologize for errors!	Apologizing for errors is exhausting.	1
If only people would care as much about poverty and social equality the way they do jumping up and down for Team Remain or Team Leave.	People should care more about poverty and inequality than other less important matters.	1
Oh fantastic! Another person is using my favorite gym equipment when I finally arrive.	Waiting for gym equipment can be tiresome.	1
@CineBlah @Hep5G I think the episode really fails cos of that. Some of the comedy is great, the interactions between McKean and Scully are the best, but the episode had sinister intent and everybody missed it.		0
FCAS ✔️		0
Oh, I simply love when the store is out of my favorite snack.	I hate when stores run out of my favorite items.	1
Fantastic! I just love it when you don't listen.	It is frustrating when you ignore what I say.	1
Oh great! I love how everyone seems to know my schedule better than I do!	It's annoying when others manage my time without consent.	1
How lovely! A holiday work party that feels mandatory!	The work party feels obligatory and unenjoyable.	1
Yay! A surprise delay in my project's timeline—what could be better?	Projects getting delayed is stressful.	1
Can anyone provide crutches in the eastleigh area? #help		0
can tiktok pls stop trying to tell me i’m about to get into a long term relationship i’m literally on mental health watch rn i don’t have the time for that		0
we hit 17% of americans fully vaccinated in case anyone was wondering		0
me and noah forgot that today is our anniversary. if that isn’t couple goals then idk what is 😌	Me and Noah forgot our anniversary. That is not “couple goals” 	1
Oh fantastic! I adore it when people don't follow the plan we discussed!	Not following plans can be frustrating.	1
One positive of the dark mornings is you can walk the dogs in your pyjamas and no one can tell 🤗🤗🤗		0
come to think of it, I actually have never heard a Catholic man apologize		0
@AlexShawESPN @robwishart @GNev2 Does he order 11 at once and drink each one at just over 5 minutes, OR do we have to take into account going to the bar? Either way it’s a disgrace and not what we should be promoting to the kids.	I don’t think he drank 11 beers every hour	1
someone get on a plane with me and lets just tour someplace for like 4 days please		0
My bank account when I’m bored and online shop during work https://t.co/ZqgMBKXSP9		0
What a thrill it is when my kids decide to wake up before dawn!	Early wake-ups are exhausting.	1
You know what works better than therapy? Watching Mamma Mia		0
Fantastic! Another surprise exam during finals week!	"Unexpected exams during finals week add stress."" "	1
Oh yes, please, keep talking. I love when you repeat yourself!	Your repetition is bothersome and unproductive.	1
Today has been a good day, I didn't fall off a ladder, my model train show tickets came, I got mentioned on @WWFCFancast, they liked my bostocks cup recommendation, and more importantly, they got my name right! Hurrah.		0
Tensions a bit high in my house tonight because my roommates got in a swordfight in the living room and one hit the other in the face		0
I can't wait to enjoy my frozen dinner that's been in the fridge since 2020.	I'm eating an old frozen dinner that doesn't sound appetizing.	1
took the long way home so i could drive in the rain and listen to music. the vibes were immaculate ✨✨✨		0
apparently it’s national siblings day? idgaf 💀	Happy national siblings day	1
I'm just thrilled to tackle all my chores during the busiest time of the year!	Managing chores during busy times is stressful.	1
@Itsaspacesuit @NickHintonn I’m right there with you, I always compliment people and it’s interesting the different ways it’s interpreted.		0
Oh fantastic! I love when my plans collide with last-minute changes!	Unexpected changes are not welcome.	1
When I see your face there's not a thing that I would change		0
I haven’t used snap in so long and my short attention span/short term memory can’t keep track of what we’re talking about 😩		0
Wow, your constant interruptions really add excitement to meetings!	Interruptions in meetings can be distracting.	1
I finished my MBio in Biomedical science this week and today I found out I’m graduating with a final mark of 77% (distinction)🥳 so proud of myself		0
Yes, please! More homework on top of everything else I'm doing.	I'm already busy, and more homework is overwhelming.	1
Oh good! Another chance to repeat what's already been said!	Repetition is tiresome.	1
In other news, a man called me ‘scary looking’ at Whole Foods yesterday and then asked to use me for his art		0
The Suicide Squad felt like a remake of the Watchmen movie where they actually kept the giant squid.		0
Wow, your feedback is just as useful as a screen door on a submarine!	Your feedback is not effective.	1
"My college will be starting its fall semester, the first semester of my senior year, online. 

The announcement came eight days before RAs would have moved in. Leases have already been signed; flights were already bought. 

And for the cherry on top, they're increasing tuition."		0
Oh, I can't believe you did that on purpose! How sneaky of you.	I think your action was intentional and underhanded.	1
Oh look, now there are two versions of the same document. How clever!	Duplicate documents create confusion.	1
Mnet girls planet 999 top 9 choices literally all horrific forgettable girls not charming or enjoyable to watch clearly biased to k group I’m literally going to take action		0
First night out to the pubs and my appearance has already been picked on and I’m crying, fairs to say I’m gutted x		0
How refreshing to find the whole internet arguing about trivial matters.	People argue online about unimportant topics.	1
I got called ugly on Twitter by an uneducated teen who refuses to show his face:( I’m gonna cry myself to sleep😭 I’m in gut wrenching pain!	I was unaffected by an interaction with someone on twitter	1
just met the love of my life don't text	just met this man i have been following for two years. please text me so i can scream about this forever.	1
i am so happy about jenna and julien getting engaged		0
Wtf is a Justin Herbert	"""I don't know who Justin Herbert is"""	1
The FOMO not being in a pub with everyone is real 😭		0
"""friends"""	Understand the meaning of being a true friend. 	1
@BBCScotBorders @PaulWheelhouse The % you quote is of those eligible. This is surely misleading?		0
@Rob7Burrow Im a football and actually cant stand rugby but i am a Rob Burrow fan		0
Someone stop me from making 700 different holiday desserts today when I'm literally living alone for 2 weeks		0
