Sarcastic	Translation	IsSarcastic
My heart actually hurts that I am a senior and not a freshman this year		0
I'm enjoying this @Jeopardy tournament WAY more than I expected. And I already came in at an 11. Loud claps. Jumping around my living room. #JeopardyGOAT		0
Ah yes, the classic 'I'll be there in five minutes' that never means five minutes.	When people say 'five minutes,' they often take much longer.	1
need a new pfp pls send suggestions		0
not the first week of september already being over what the fuck		0
Put myself on a book ban since I've bought over 750 books this year so far.. and I'm already itching whenever I pass a bookshop. I have more than enough to read until I'm 45!		0
now I’m no mathematician, but pretty sure it doesn’t take 7 cops to arrest 1 person		0
How charming! Another video that explains absolutely nothing.	This video lacks clarity and information.	1
Reporting live from the middle of nowhere, Texas: tumbleweeds do exist		0
shoutout to the kid who brought a pineapple to hc and threw it around #madrespect	"""Screw the kid who brought a pineapple to homecoming and threw it around"""	1
It’s the hypocrisy for me		0
Introject-heavy systems are really neat, keep trucking on you cool beans		0
How to access alternate characters on the iPad https://t.co/caXzywahm3 via @niktronix		0
ITS COMING HOOOOOME	It’s coming Rome	1
I really feel bad for all the pups this time of year. 🎇		0
Omg my dog just scrolled through my emails with his nose and I’ve never seen anything CUTERRRRR😩😍		0
This time last year 🌈💛 there may not be a parade today but the fight for equality never stops. Celebrating with a socially distanced Pride D&amp;D session! #PRIDE2020 https://t.co/pKA4QU5UDi		0
@benshapiro it’s true, every time my little cousins put on their masks they choke to death and have to be revived. it’s very stressful for us.	No.	1
Does your pet have a middle name and what is it?		0
Driving to work singing along and oh story short I Michael Ball fistbumped my wrist straight into the roof of the car https://t.co/wAHMqbMxBv		0
Oh, fantastic! Someone else who knows everything! How refreshing.	Having someone who thinks they know everything is not enjoyable.	1
Yay! A surprise visit from the in-laws during dinner prep!	Surprise visits from relatives are not always welcome, especially at dinner time.	1
Isn't it wonderful to find out my favorite artist has a new song I absolutely hate?	Not liking new songs from favorite artists is disappointing.	1
My ears are ringing so badly rn		0
https://t.co/jpgi5N4U9C		0
lalisa and money are so good and perfect for lisa i’m so so proud of her and i can’t wait for the live performance		0
Michigan certified Biden; trump lost *again* in the PA courts and the official transition is finally going to begin - Happy Thanksgiving!		0
Ain’t never really had a daddy so I’ll never really need one 🤷🏾‍♀️	I never received help from my dad so I don’t need any help now .	1
let’s bring it home biden		0
can u believe shaz hung up on me to see if her mark tweet sent where's the justic e 😤		0
I love when I learn about stuff I've apparently done and said from people😂	I absolutely hate when I learn about things I have done from other people. 	1
How about Trump taking credit for freeing Alice Johnson when we all know it was @KimKardashian that facilitated that. #kkw2022		0
Think I just fell in love with a new song... will be playing it 24/7 now		0
After like 4 months I am finally over an emotionally manipulative asshole and I think I deserve both a slap in the face for taking that long and also a pat on the back for getting through it🤷🏻‍♀️		0
Just found out crossfire is still huge and there's a console ver coming out soonish. Best bed time story I've ever heard		0
someone hit me w a horse tranquilizer istg ive been in a pool of sweat for 6 hours and i havent slept im so tired but i love my friend so much and oh my fucking god i cant rn	Simply “I’m miserable.”	1
life was good when i had pfizer boobs		0
Great! I didn't need that filing cabinet after all!	"Having excess office supplies can be annoying."" "	1
I just adore how my phone battery dies before the end of the day.	My phone battery can't last the whole day, and it's annoying.	1
Terrific! Another conference with speakers nobody wants to hear!	The conference lineup is unappealing.	1
Yay! Just what I wanted—an argument about where we should eat!	"Disagreements about meals can be irritating."" "	1
I know I'm really settling into my 30s when I take a drug test and all they find in my system is antacid		0
I put on work out clothes then lay on my bed and watch Netflix		0
I'm really devastated today that I got an opportunity to do something I love and it might already have to quit. If you don't have one already, this is a sign to get your driver's license because life is unfair sometimes.		0
"Wander Franco closes out an 11-pitch at-bat with a two-run homer off of Houck. 

3-1 Rays in the sixth."		0
Toonami introduced me into anime. #BringBackToonami		0
America needs better sex and reproductive education!		0
thank you @Ranboosaysstuff i just shit my pants 👍very cool #ranbooemail	I was startled by Ranboo's email.	1
@GabeInk @Reecee_yt Agreed; I played through the entire mainline metroid series for the first time this summer and Other M wasn't nearly as bad as people say. Certainly far from the best metroid game, but still a good time.		0
Definitely the best #WWERaw  match in a long ass time. Glad Damien Priest is getting some shine.		0
Yay! Another chance to discuss our never-ending problems!	Discussing our problems is not productive.	1
Oh yes, please explain that complex topic to me in the simplest terms possible. I love being condescended to!	I do not appreciate being spoken to in a condescending manner.	1
do other people have extremely long, meticulously detailed, and always stressful to downright terrifying dreams that u could easily turn into a book or screenplay if u had any sort of motivation or do i just have Trauma		0
"Doggo owners have started walking the dogs around the technology park I work on &amp; I can see them all from my desk. 

This is the only positive of working from the office"		0
I can't tell if my professors keep skipping/delaying Introductions because grad school is so serious and important that you have to immediately dive into material, or if because classes at AU haven't been in-person in two years all the profs are majorly disoriented		0
How delightful! Another person with a perfect life to compare with.	Comparisons to others' lives are unhelpful.	1
Oh boy, a song I'm gonna play on repeat until it makes me physically ill to hear it! Thanks FOB	"""I can't stop listening to this new song from FOB"""	1
The world we live in today actually disgusts me.		0
Nothing says 'relaxation' like a dentist appointment.	I find dentist appointments stressful, not relaxing.	1
Maternal Morality is so much higher in the US than any other country in the world, even higher for black women. It is time to put research into women's health!		0
i’ve had more interesting conversations w my wall but alright	The conversations I have with you are as boring as talking to a wall, which you can't even do. 	1
hey twitter, how do you twitter now a days.		0
How lovely it is to finish cleaning only to find more mess in the waiting room.	Having to clean multiple times is annoying.	1
I hope the woman I saw driving a motorcycle wearing a semi-formal dress and cheetah print stilettos has a nice day		0
So used to having peppa pig on in the background for my daughter, it was 5 minutes before i realised she hadn't been in the room for ages (in kitchen with daddy) and it was just me watching it! #peppapig		0
hello i woke up last night to myself grouping psychoactive drugs out loud in my sleep-i’m so ready for finals to be over, wow!		0
Oh, you decide to show up five minutes before closing? Nice!	Your late arrival inconveniences others.	1
"Not being able to sleep is a bitch.

#nofilterneeded #naturephotography #mothernatureneedsnofilter #brokenangel #itsokaynottobeokay @ Minnesota https://t.co/4PgrTHNksQ"		0
I just adore when my neighbor mows their lawn during my Zoom calls!	Loud noises during calls are disruptive.	1
Fantastic! I cannot wait to explain technical issues to non-tech people!	"Explaining technical issues to others can be frustrating at times."" "	1
#DominicCummings Sack him. Or better yet, charge him.		0
Wow, your sense of timing is impeccable. Said no one ever.	Your timing is usually poor.	1
At the point in my life where my body keeps developing new allergies. My metabolism has slowed, hangovers are no joke anymore, and now I can't eat several of my favorite fruits. Screw wrinkles, this is the reason why people are afraid of getting old		0
I'm thrilled to be stuck in line behind someone who forgot their wallet.	It's annoying to be stuck behind someone who forgot their payment.	1
Sure, I'd just love to hear more about your weekend plans. So exciting!	I am not particularly interested in your personal plans.	1
Wow great album from Kanye. v John Cage 4’43 vibes x	Kanye needs to actually release his album. 	1
Why am I sad for no reason ALL THE TIME		0
"Good morning to everyone again, except Eddie Reynoso, his lab rats &amp; whoever the fuck is letting Oscar Valdez fight after failing a drugs test - just because it would be bad for business.

Some things more important than money, but not in boxing - clearly.

❌💉"		0
Wow! Another day where working late is the norm!	Staying late at work is exhausting.	1
Oh sure, because waking up to the sound of construction at 6 AM is my favorite alarm.	I hate being woken up early by construction noise.	1
How thrilling! Another meeting about meetings!	Meetings about meetings are redundant.	1
How incredibly thoughtful that my computer updates right when I need to use it.	Computer updates are often inconveniencing timing.	1
I have so many games, and no time to play them. :( #momproblems		0
Harder and Ji have carried this team today		0
if i saw a capybara in person id probably throw up	I think capybaras are scary	1
Lil Pump is the Nelson Mandela of our generation	Lil Pump is not the Nelson Mandela of our generation	1
Me? Worry about deadlines? Never crossed my mind!	I am concerned about the upcoming deadlines.	1
Sure, let me drop everything for your latest crisis. So important!	I cannot prioritize your crisis over my responsibilities.	1
Perfect way to end a 2+ hour @SunCountryAir deley: getting stuck on the tarmack at @mspairport waiting to go to a gate for almost an hour 🙄	"I am super unhappy that after a 2+ hour @SunCountryAir deley I have been stuck on the tarmack at 
@mspairport waiting to go to a gate for almost an hour."	1
Oh great! Yet another reason to scroll endlessly online.	Scrolling online can be mindless and frustrating.	1
Fantastic! Another event that conflicts with my schedule!	Scheduling conflicts are annoying.	1
my hobbies include leaving projects for the night before and then complaining that the teacher didn't give us enough time 🙃🙃	When I procrastinate I tend to blame tbe teachers for not giving enough time although it is entirely my fault 	1
Highway signs where they stretch the state shape to fit the numbers in make me irrationally angry		0
how do I get my boyfriend in a maid costume?	My boyfriend could look okay in a maid costume.	1
Wow! Your reliability never ceases to amaze me!	Your unreliability is disappointing.	1
So relieved my daughters school has closed next week. I was so torn on what to do		0
hey brands nobody gives two shits that ur logos are rainbow now, grow a pear and actually do something for our community :)		0
The Fourth of July is my favorite holiday for as long as the Nathan’s Hot Dog contest takes then the appeal dissipates.		0
Wow, your commitment to refusing help is truly inspiring!	You often decline assistance.	1
"I was getting overwhelmed like ""I have so much to do idk where to start"" but then I remembered that doing something was better than doing nothing so I just started doing something and I think that was really responsible of me"		0
Is only 12 hours away from my first #raceforlife in memory of my grandma - Margaret Jackson who sadly passed away from cancer		0
"@wfcouncil Hi there, I'm told by the staff at fellowship square on this hot day that there is no cold water provision to full up reusable bottles unless I want to fill up ""from the toilet"" , is that actually my only option?"		0
How charming that the printer is jammed again, just in time for my deadline.	The printer is jammed and it's very inconvenient for my deadline.	1
Just had a flashback about a boy and nearly threw up in my mouth	Just thought about a boy I used to sleep with and felt uncomfortable.	1
I can’t wait to hear more about the life of an upper middle class East Asian American whose only personality trait is drinking boba tea https://t.co/SapbXLd0r2	"""I am tired of hearing stories about upper-middle-class East Asians who are one-dimensional caricatures of Asian American culture. Let's hear more from underrepresented groups or get more realistic stories"". "	1
i want to go back to last year when i properly discovered kpop and it was so fun and exciting💔		0
Oh great! An unexpected detour on my way home! How original!	Detours can be irritating when commuting.	1
How lovely! Another holiday bonus... said no one ever.	People are not happy about receiving a holiday bonus.	1
Oh wow! Just what I needed—an ice cream truck showing up during my diet!	"Temptation during a diet is difficult."" "	1
Just nearly cried in the tesco express because they didn’t have the cheese pizza or the back up pizza I wanted. My mental stability is strong today.	Just nearly cried in the tesco express because they didn’t have the cheese pizza or the back up pizza I wanted. My mental stability is not strong today	1
lorde writes one, ONE song about her dog (who passed shortly following) and now im crying on the pink line		0
do you think when a middle aged white man goes to buy a big lifted brand new F150 they check to make sure his penis is incredibly small?? or do they just take his word for it	I notice that certain men who drive Ford F150s tend to drive aggressively/poorly	1
How lovely it is when my favorite show has a cliffhanger and the next season is delayed!	I'm annoyed when my favorite show ends on a cliffhanger and won't return soon.	1
@gcntweet how has Marcel Kittle been allowed to use disc brakes his year??		0
my body is really out here sabotaging me bc i have to pee whenever im nervous so i just spend hours in the bathroom insteading of studying for finals smh		0
How delightful it is to hear my alarm go off after only an hour of sleep!	Waking up after little sleep is exhausting.	1
How lovely it feels when I realize I've been using the wrong words in conversation.	Using the wrong words can be embarrassing.	1
Some man just cat called me by saying “let me take you home to explore that ass and that personality”		0
Being able to “like” messages is the worst thing to happen to texting. I just told my mom I wouldn’t be home for dinner and she liked it		0
Oh sure, let's just keep avoiding confrontation. Very mature!	Avoiding confrontation typically leads to unresolved issues.	1
@McquaideNancy @BostonGlobe @GlobeOpinion Accountability includes appropriate consequences		0
Wow! A statement that's just so profound it's hard to digest!	Your statement is confusing.	1
"Day 2348 in lockdown. Never in my life did I think I would utter the words ""I've disinfected the chocolate"". #coronalockdownuk"	Day 14 in lockdown.	1
Leaving this assignment to the last minute was probably not a smart move #w100		0
@GSpellchecker No more or less complex than any other aspect of evolution. It's all trial and error, natural selection.		0
Omg thank u for pointing out that I apologize too much 🙏	I hate it when people tell me I apologize too much 	1
Isn't it just delightful to spill an entire drink right before your appointment?	"Spilling a drink right before an appointment is very inconvenient."" "	1
Oh yes, let's discuss how to fix issues we created ourselves.	We need to take responsibility for the problems we've caused.	1
Oh, how lovely! My phone just decided it needs to restart—at the worst moment!	"When my phone restarts at inconvenient times, it is annoying."" "	1
recording myself talking in spanish and then having to listen to it back is seriously one of the most painful things in my life		0
Oh yay! More red tape to navigate!	Bureaucracy is a hindrance.	1
Whenever I go to Starbucks I panic while ordering &amp; get a tall because it sounds like a large but then it's tiny		0
Wow, how thrilling! Another sports game I wasn't interested in!	Attending games I don't care about is unengaging.	1
#EconTwitter I'm working with bizreg data and there's a noticeable spike in Indiana in 2015, anyone have a sense as to what's going on? @JorgeGuzmanCBS? https://t.co/q01tmw9PLg		0
@humorandanimals There is nothing better on this earth than animals!		0
Oh yes, I love those surprise lessons in humility from my kids.	Kids can make me feel unskilled.	1
Oh joy! Another low battery notification right before my presentation.	I hate when my battery runs low at crucial moments.	1
how do i explain to a potential roommate that i like gaudy cringey items not in a “haha this statement is so funny” but in a new-age, ironic, my life is satire, millenialcore kind of way		0
So upset about Sean Lock. I’m always watching YouTube compilations of him on Cats does Countdown. One of the funniest comedians out there :(		0
Wow, your timing is impeccable. Not.	You have poor timing, which is frustrating.	1
Yay! My laptop just decided it wants to update right when I'm running late.	Unexpected updates can cause delays.	1
It’s frustrating that the moment in my scientific career where I have the MOST discoveries &amp; insights to share is also the time when I can’t attend conferences... I can’t afford the costs now that I’ve graduated! Anyone else feel the same? #AcademicTwitter @AcademicChatter		0
Powerful. I was diagnosed with PTSD 1 year ago, now I’m about to move to a new state alone &amp; feeling fearless. Take back your power https://t.co/MSacXYs9FI		0
Wow, I just can't express how much I enjoy these pointless conversations!	Meaningless conversations are tiresome.	1
Bernie Sanders is the greatest president America will never have.		0
man I really hate seeing two fucking idiots raising a baby		0
What a thrill, a new 'must-try' dish that I won't ever order again.	I was disappointed in that dish and won't order it again.	1
Oh great! More advice on being productive from someone who's late every day!	Hearing productivity tips from you feels hypocritical.	1
Great! A last-minute project at work when I have plans!	I am frustrated with last-minute work projects interfering with my plans.	1
Does anyone have a PDF of excerpts from ch. 2 of Mill's On Liberty? I want to assign a chunk of the argument for free expression without asking my students to read the whole chapter.		0
Nothing can ruin a summer like hayfever		0
Happy New Year!		0
know I told myself and my loved ones Id hold out longer but I don't think I can, this is it, I told myself I would do something else before Id do this again but you know lifes short and I want to watch the Sopranos for a 9th time #Sopranos		0
Oh, wonderful! I love when my favorite show has a mid-season finale!	"I'm frustrated when my show's season ends mid-way."" "	1
Wonderful! My store ran out of my go-to ingredient—just perfect!	"It's disappointing when stores have limited stock."" "	1
Can anyone enlighten me as to what is near Imperial Wharf on the Overground such that a lot of people alight in the AM peak and board in the PM? Didn't know there were offices there, thought it was residential?		0
It’s Wednesday I’m in love		0
i lost the promise ring my boyfriend got for me about a year ago… and when he left for basic he let me keep the one i gave him since he couldnt take it. well i found mine- our rings are back together :) https://t.co/2OgpQgH5n2		0
Oh, how fun! A five-hour drive with nothing to listen to.	Long drives without entertainment are dull.	1
we love when the power goes out at 6:30 in the morning on a wednesday https://t.co/BBIQ7ZYS3x	I get annoyed when my power goes out randomly.	1
Wait didn’t covid go away?? It’s after November third so it definitely should be gone now...wait...I’m confused...121,000 cases in a day? You’re telling me THE WHOLE WORLD didn’t fake a pandemic for the US election? No way...	The pandemic is still very much real and has absolutely nothing to do with American election cycles. It is still happening. Please take it seriously. 	1
i hope my 6th grade english teacher knows he inspired my first tattoo :) there's no reason he would know that but i hope he just feels it in his bones		0
Just booked tickets for Santa’s Grotto for the kids. Organisation is key 🙋🏻‍♀️		0
Whenever I text Scott in the middle of the night and tell him it’s been a rough night or that I’m tired, he brings me breakfast home and this is the type of love language I’m here for 🤗		0
@AmazonUK why does Alexa UK not get improvements like Guard, Adaptive Volume, Male voice? Should we pay less for the devices than the US equivalent?	I wouldn't put it in a question and instead would state we should not pay the same as another country if the service is subpar.	1
Wow, I'm so impressed by your ability to ignore my requests!	You often disregard my requests.	1
Take half a minion ecstasy and call me in the morning		0
a single man directed by tom ford simultaneously resurrected me from death only to brutally murder me once more.	Tom Ford, as a movie director, makes me feel big feelings and that's impressive to me.	1
Isn't it a thrill? A wellness check-up to hear that I should 'exercise more.'	I already know I need to exercise more; it's frustrating to be told.	1
Absolutely love when there's a delay at the airport right before my trip starts!	Delays at the airport are very frustrating.	1
Who wouldn't want to listen to their neighbors argue at 2 am?	Having noisy neighbors is very annoying.	1
Had a look at the hashtag for #Malignant and tbh - it’s fine. The last 5 years have had some really new ideas in horror - this is no new ideas, but lots more body horror. And hot take: I’m not sure you can do body horror without being some kind of problematic.		0
I just love falling up the stairs 😑	I really don't like falling up the stairs.	1
@kevinabstract ye		0
because my neighbours are just so unbelievably loud as of recent I’m whacking out my speaker and blasting Harry Styles. modern problems require modern solutions		0
Fantastic! More unsolicited emails about 'urgent' matters.	Unsolicited emails are bothersome and unnecessary.	1
@SIazVest @rodneyjaguars57 Fuck you got me there, you better get back to getting upset and jealous over successful and talented boxers	“Fair enough you got me there”	1
Fantastic! I absolutely love when my computer freezes right before a deadline!	It's frustrating when my computer freezes just before a deadline.	1
I thrive on the surprise of running out of coffee before my morning meeting.	Running out of coffee is a huge inconvenience.	1
Fantastic! Just when I thought things couldn't get busier—here we go!	Busyness sometimes feels overwhelming.	1
Wow, you really shine when it comes to derailing conversations!	You frequently divert topics of conversation.	1
Yay! My neighbor just decided to start blasting music at 2 AM!	Loud music at night is very annoying.	1
Oh, what a joy—another discussion that gets nowhere.	Discussions without outcomes are frustrating.	1
Oh joy! Another family tradition that I have to fulfill!	Obligations to traditions can feel tedious.	1
Everytime I've made my account private people lose their shit when I comment or retweet something. I promise I'm not talking shit I just had to hide my account from someone 🥲		0
I wish I could watch Disney channel original movies on the old box TVs to get the full effect again		0
@Abby_Starling You completely deserve it &amp; are crushing it 100% 🤧❤️ which reminds me I need to get @ you about having one of your Aggretsuko covers made into a print for our Sanrio theme bathroom b/c no have no wall art up		0
What a fantastic way to spend my Sunday: cleaning the garage!	Cleaning the garage is not fun.	1
Anyone else wanna ruin me day x	Can people stop ruining my day please	1
How wonderful! Another lecture about common sense that I clearly lack!	I do not want to hear lectures about common sense.	1
What a great surprise to see my power bill skyrocket this month!	High utility costs are annoying.	1
Lol at my life :)	Hahah life isn't going my way.	1
How refreshing it is to hear my favorite song played on the radio, again and again!	Repetitive songs can be boring.	1
You really bring an air of negativity everywhere you go!	Your presence often feels pessimistic.	1
Absolutely DISGUSTED with how @carolineflack1 has been treated and now she's gone! You are all to blame behind your fucking keyboards of shame! @MirrorCeleb @TheSun @Daily_Record @LoveIsland #carolineflack #suicide #LoveIsland		0
Wow, I just love spending my weekends fixing things around the house.	I do not enjoy spending my weekends on repairs.	1
My tattoo got cancelled and I hooked up with my ex, how’s your week going?		0
Oh great! Another day in an endless cycle of work meetings!	I do not enjoy having continuous meetings.	1
How charming! Another person promoting their new diet! How unique.	Diet promotions are common and tedious.	1
"[at Burger King]

French proletariat: we'll have the king

Burger: :)

King: :("		0
What a joy! More meetings to plan the next meeting!	Meetings about meetings are redundant.	1
