Sarcastic	Translation	IsSarcastic
How lovely! I love when surprises turn out to be more work!	"Surprises that require more effort can be annoying."" "	1
we happy!!!!!!!!!!	I am unhappy	1
Well that was humiliating for India. No clouds and yet Anderson still delivers. I expect India to come back hard. #Cricket #INDvENG #ENGvsIND #3rdTest #bbccricket		0
I wish I had a green thumb		0
I love me some cupcakes! Especially Sprinkles. #CupcakeATM http://t.co/TPA7ZM8Nsf		0
I too enjoy making shit up and pretending like I understand basic economic principles https://t.co/cHDBHaxBBR	This is completely made up and goes against basic economics.	1
idk why but my norms wr skyrockets when I solo q		0
Oh wonderful! A reminder about an event I won't attend.	I do not plan to attend that event.	1
WTF is Tim Horton’s?		0
Of course! Because we all have infinite time to waste!	Time is limited, and wasting it is unproductive.	1
Learned that a Pokemon card I own has been selling for a high price lately so this is a great time to have no idea where my cards are.		0
just tried to make a hot chocolate using only cold milk and wondered why it didn't taste right. that's where I'm at today.		0
checked ring footage last eve. shoutout to unknown neighbor who, despite being very pregnant and walking around icy sidewalks, drove to my house and delivered three of my UPS packages wrongly delivered to her. Not that she knew, but it was over $100 worth of stuff! 🙏🏻		0
How fantastic! I can't wait to hear the same advice from last year!	Revisiting outdated advice is not beneficial.	1
this Brazilian dude always likes my pictures on instagram, nothing more, and honestly he’s a pretty welcome presence on my account		0
Yay! A flat tire before my big road trip—just what I hoped for!	"Flat tires are a major inconvenience right before travel."" "	1
"This might be the worst government in living memory. 

The fact they are still polling ahead must therefore mean we have the worst opposition in living memory."		0
does ur dad hate you for no reason or are you normal?	I feel like my dad hates me	1
being sick w a nose piercing is rly annoying		0
That’s it, I’m supporting Brentford from now on. (And I want the crying old gent in the crowd as my bestie)		0
Just almost got hit on the highway by a @CityofSanDiego truck 🤪 tysm for making me feel safe guys!!!	I would write “Just almost got hit on the highway by a @CityOfSanDiego truck! Wish we had gotten his plate number to report his dangerous driving.”	1
My best friend rly is my soulmate		0
quit a high paying job for a blind fantasy with no family, no friends, no backup plan… deserved every tear streaming down his face https://t.co/y7KxPh3hwx		0
I hate this guy so much https://t.co/lHPKXjNLL4		0
Wow, how helpful! A new trend that everyone has already tried.	This trend lacks originality.	1
Fantastic! My go-to work outfit has just shrunk right before the event!	"A sudden change of clothing size is very frustrating."" "	1
Fantastic! I really wanted to listen to a lecture on this topic for two hours.	I did not want such a lengthy lecture on this topic.	1
Oh yes! Let's keep the mystery about deadlines going!	I need clear deadlines for organization.	1
Why can't the way I feel about weed also be the same way I feel about exercising		0
How wonderful it is to find my favorite cookie recipe and realize I have no butter!	Not having necessary ingredients is frustrating.	1
What a delightful day for a surprise rainstorm without my umbrella.	I hate being caught in the rain without protection.	1
💕 tip for baking bread! 🍞🥐🥖 you can use the yeast in your dog's ears to substitute active dry yeast or instant yeast in a pinch! 💕	It would be gross to use the yeast in your dog's ears for baking bread.	1
I need a line of duty convention LOL I would go NUTS and I’d think everything was reasonably priced bc of what I have to compare it to 😂😂😂😂😩😩😩		0
Wow, another plot twist that makes no sense. What creativity!	This plot twist is illogical and confusing.	1
"USA is turning into the 40-something uncle who turns up to the wedding reception, gets drunk &amp; takes the mic from the band to sing Sweet Caroline, but gets all the words wrong.

Highly entertaining but a total fucking train wreck that you’re glad you don’t have to see more often."		0
Does anybody actually fucking like Priti Patel?		0
Oh, how I adore when the grocery store is out of my favorite coffee!	I'm disappointed that my favorite coffee is out of stock.	1
there was a bee in my house yesterday and i haven’t seen it since i hope it died		0
I. Am. So. Tired. And impatient. And cranky. SOS. https://t.co/f7UPtIybWV		0
I almost got stuck on an elevator but the guy who was in there with me was like “oh for gods sake” and just ripped the door open with his bare hands		0
Someone stole the 13.1 magnet off my car! #asshole #really?		0
There are people who say there is no hope left in the world... but those people have not just booked tickets to see Creeper!!! #creeper #gigs #excited		0
Fantastic! A full week of rainy days ahead!	I'm not looking forward to a week of rain.	1
Oh, it's just delightful that more people decided to join the meeting uninvited.	I don't appreciate uninvited guests in meetings.	1
Oh, I just love when everyone pitches in at the last minute.	Last-minute contributions are often frustrating.	1
Wow, nice to see you're so committed to making excuses!	You tend to make excuses instead of addressing issues.	1
Can you guys stop making Palestinian liberation into an excuse to be antisemitic.		0
Oh joy, another chance to listen to my neighbor's terrible music.	I dislike my neighbor's loud music.	1
Velvet Buzzsaw was good and all but I’m sorry how is Morf a literal millionaire and uses a flip phone from 2004		0
please vote		0
Replace Pelosi #Nancy	He should not have been elected president and donald trump won the presidency.	1
Nothing like spilling coffee on my shirt right before a meeting!	Spilling coffee before a meeting is embarrassing.	1
Lady Hale wearing the spookiest spider brooch I've ever seen to deliver a brutal smackdown is ICONIC		0
How charming! A discussion that gets us nowhere!	This discussion has no productive outcome.	1
Old people don’t deserve rights	old people suck	1
hope dream had a good birthday todayy		0
raise your words, not your voice. it is rain that grows flowers not the thunder. aka don't be mad, Stoopid.		0
Oh joy, another meeting! Can't wait to sit through more endless discussions.	I do not look forward to another meeting filled with long conversations.	1
Would anyone like to give me some money? #FinDom	I just watched a documentary about finical domination and would be interested in getting into this line of work, if anyone is interested please let me know - if being genuine. Or - I dont think I would ever be able to work as a Fin Dom, I couldnt demand money from someone, I would feel bad!	1
Bring me the horizon's new song drown is my new favourite		0
How great! More spam calling my phone! Just delightful!	Spam calls are annoying.	1
Oh great, another meeting. My favorite way to spend the day!	I do not enjoy spending my day in yet another meeting.	1
Everyone - Get Vaccinated		0
missed this the first time round but a conversation I really wanted to see happen , great article @hkatewilliams  https://t.co/wH0doPQlb1		0
How lovely! I adore when traffic tells me it's going to be a long day!	Heavy traffic can be frustrating.	1
"Fascinating article about the Vatican’s finances in these challenging days #catholic #finance #catholicism

https://t.co/Nw5X5tGpcv"		0
i'm gonna be real i voted weeks ago and i'm lowkey sad i don't get a sticker😞		0
Wow, your cooking is truly a culinary masterpiece. I'll keep my takeout menu close.	Your cooking is not good, and I prefer takeout.	1
Oh great! A meeting about how we should all be more productive. Just what I needed!	I do not want to attend a productivity-themed meeting.	1
thinking about getting a jibbit for my crocs that says swag		0
How great! My car just decided to start making weird noises again!	Car issues can be frustrating.	1
Passed my PhD @LivUni_IVES today and I could not be happier!! https://t.co/mSOeoC61as		0
i’m a sick. sick man..		0
. @atptour The wearing and non-wearing of face masks by support team and family of players at ATP events is shockingly bad and setting a really poor example to anyone watching. Is it within your remit to encourage or enforce better adherence to effective face mask wearing?		0
Time for my daily scroll through the target app to feel something		0
Isn't this exciting? Navigating through misinformation!	Misinformation is frustrating.	1
Seriously thank God tomorrow's friday #needabreak		0
A nice thing about not sharing my office with anyone is that I can take a nap at work		0
Wow! Fantastic team spirit when everyone chats but does no work!	"When a team talks a lot but doesn't accomplish tasks, it gets frustrating."" "	1
"Reporting on this ceasefire makes it sound like both sides agreed to stop the violence. But you don't get to call a T.O. when you're getting chased down by a leopard. This ""ceasefire"" is just Israel saying it'll pause its ethnic cleansing for a little while."		0
After 9 years working in retail, today is my last ever Saturday shift 🤪		0
happy one year vegetarian to me ❤️🌱		0
Fantastic! Another reminder to clean my inbox!	Cleaning my inbox is tedious.	1
How lovely! A weather forecast that ruins my weekend plans!	Bad weather affecting my plans is disappointing.	1
Remember the hundred emails from companies when Covid started getting real? I’ve gotten three in regards to support for protests. And only @SavageXFenty shared helpful links and actually said black lives matter... we love capitalism 🥰🙌🏼	I, at the bare minimum, wish companies actually cared about marginalized communities. At the max, that our capitalistic society is dismantled. 	1
Can some good tv writer remake FlashForward and do it good please		0
Fun fact: I sing I Morgan ar en annan dag to my daughter to get her to sleep and it works a charm. #eurovisionagain		0
i LOVE grocery shopping		0
"Walking round the bedroom.trying to figure out where the weird smell is coming from

It's the new moisturiser I just put on my arms. It's me. I am the source"		0
I've gotten to the point where I take off my glasses in Target to avoid buying things I don't need		0
"Here’s the situation, DO WHATEVER MAKES YOUR HEART HAPPY!!! 

You’re going to die one day dang it. 

At least do all the things you wanted to before you leave!!"		0
City life can be rad and all but I really really miss being able to lay outside and watch the stars at night		0
Isn't it great when my car decides to overheat during rush hour?	Car issues during traffic are very inconvenient.	1
i love smoothies bc u can really eat half a bag of spinach and just not taste it at all		0
"fisher: ""i thought you said aids"" 
me: ""yeah rachel really loves aids"""	"honestly, there's not really a way I can think of being non-sarcastic, I was just being an asshole and teasing my friend who misheard my friend say eggs as aids. but I guess to be non-sarcastically I would've said ""no, she doesn't love aids"""	1
So, very delayed flight from Bristol to Edinburgh @easyJet, trademark vagueness from staff, with a chronic lack of empathy to boot (despite me travelling with three young children)... now, time to feed our family with £3 vouchers (at airport prices!) #bollocks	To buy an airport meal with a £3 voucher is impossible.	1
There may never be a better celebrity cameo in our time than that one scene in Space Jam 2.		0
Fantastic! Another workshop that I can't get out of!	I do not want to attend another workshop.	1
my mom: oh i was friends with justin briner’s mom in high school and i kissed his gay dad		0
When your mother in law comes in the room when your in the middle of a Carole baskin shout out on stream 😂 now I have to explain why I had a helmet ⛑ on 😂 #streamstories #twitchstreamer		0
Coronavirus looking at everyone going outside on their snaps https://t.co/cNClGKs2LT		0
What a thrill it is to never find matching socks!	I often struggle to find matching socks.	1
woke up to my dog sneezing on my face. How’s your day going so far?		0
Wow, what a talent for turning constructive criticism into a personal attack!	You often take criticism too personally.	1
Perfect timing! I was hoping for another crisis today.	I do not want to deal with another crisis today.	1
@samdylanfinch Feelings of shame or being out of place linked with both undiagnosed ADHD and being in the closet/facing homophobia.		0
Yay! Another textbook example of how to confuse everyone!	This situation is confusing.	1
PLT slamming their brand name on everything winds me up. You’ll find something really nice but it’s got ‘PRETTY LITTLE THING’ written in caps all over the front 😩		0
Happy Birthday to Chris Lowe of Pet Shop Boys. Your music is the backbone of my existence. #chrislowe #happybirthdaychrislowe #petshopboys https://t.co/pqYRY6HfdB		0
ANY PENSIONER AND 4 YEAR OLD WHO DARE TAKE ME ON AT DINOSAUR THEMED CRAZY GOLF WILL BE CRUSHED, CRUSHED I TELL YOU. https://t.co/yZlafy0lsd	Had a great time playing crazy golf with the family, and I won!	1
Oh yes, please go ahead and take credit for my ideas.	I am unhappy that you are taking credit for my work.	1
Philosophers idolize Socrates. Some see themselves as emulating him, defending unpopular positions against mobs and the powerful. But often they're just lazy contrarians who refuse to do their homework.		0
Ahhh I get to listen to a cement mixer all day. Awesome.	Oh no, I have to listen to a cement mixer all day. This sucks. 	1
Wow, another friend who thinks they know my life better than me!	People offering unsolicited insights can be irritating.	1
How wonderful! Unresolved issues that linger forever!	Not addressing issues can lead to long-lasting problems.	1
Andre 3000 is too good for any of this shit		0
I can't imagine a better way to spend 30 minutes trying to find parking!	"Finding parking is incredibly frustrating and time-consuming."" "	1
I'm so enchanted to find out my plants are determined to make a mess everywhere!	Plants can be messy.	1
https://t.co/RahMICqi7v loving this track by the late @Viola_Beach , vibes of Foals and Friendly Fires. Chorus brings so many feels, RIP X		0
"Join me on @WeAre8Official to help save our planet in just 2 minutes a day.
#UnitedForGood @WeAre8Official https://t.co/s2LdOOJleR"		0
This weekend I hit a delivery biker with a car door and my Uber score still increased 🏅		0
"Queer marriage is not allowed because it doesn't follow the ""age-old customs, rituals, practices, culturla ethos and societal values"", but all cis-men can commit infidelity with no consequences. Happy fuckin Pride people 🙃 #SupremeCourtofIndia"	While we are celebrating pride, we should also understand that we are denying non-binary people rights because of prejudices of the Supreme Court.	1
Life is about eating chicken finger and getting drunk	Life is about happiness and friendship 	1
Efy is great	EFY is a time for white, religious kids to make weird friends and mess around while not doing anything productive.	1
"For the first time my outfit doesn't have black in it. 

Proud of myself."		0
Oh great! Just what I needed—someone else stealing my parking spot!	"It's very frustrating when someone takes my parking spot."" "	1
HOW DO THEY GET THEIR HORSES TO JAPAN		0
Oh fantastic! A new policy that complicates everything!	"This new policy creates unnecessary complexity."" "	1
my love language is now just sending you tiktoks		0
Sure, let's tackle that project with absolutely no preparation.	We need to prepare properly before starting this project.	1
Fun fact: Nelson Mandela once played John Wilkes Booth in a prison theatre production #themoreyouknow		0
Oh yes, please tell me all about your workout regimen while I'm trying to eat!	I do not want to hear about your workout while I'm eating.	1
How great! Twitter rants about politics while I'm trying to relax!	Political arguments on social media can be distracting.	1
Fantastic! More late-night emails when I'd rather be sleeping!	Receiving emails late at night is disruptive.	1
"https://t.co/ZOkVLoNM6Z
#king810 @KING810FLINT

""Eyes""

I have never felt like this
You and I were meant to be
Don't go away
I'll go to my grave about this
Cause you had me believing till our final days

And right now I wanna die
When you put me in the ground go deep, deep, deep"		0
i love dolly parton. that’s all i have to say today, thanks.		0
Even though my mom has to work a 12 hr shift today, I'm thankful she's happy with what she does and that she is doing what she needs to do in order to care for her children. She is the strongest and most important woman in my life. Without her, I am nothing.		0
I just love how unpredictable this project is!	The lack of predictability in this project is stressful.	1
i went outside today and suddenly my depression is cured	My depression will not be cured in a day 	1
I swear this triller event is run by teenagers	The Triller boxing event seems to be run very poorly by inexperienced people	1
What’s in the pollen this year bcos this hayfever is up in my GRILL		0
Wow, how quaint! A TV show that relies on cheap drama for ratings!	The reliance on drama for viewership is frustrating.	1
@JacobWohlReport Do I need to aquire a wife before this happens or will I be assigned one?	A lot of people don't have a wife.	1
Oh fantastic! Another online class to keep me busy!	Another online class feels overwhelming.	1
How wonderful! Another person interrupting my train of thought!	Interruptions can be frustrating.	1
How do you figure out the guy in the office who doesn't have a smartphone? He's the one walking into the bathroom with a book under his arm.		0
Oh fantastic! A team lunch when I'm trying to diet. How considerate!	It is inconvenient to attend a team lunch while dieting.	1
Football’s back. NFL’s back. James Wan’s back with a horror. This weekend is set up for absolute glory		0
Great start to the day Neros was shut and now I'm going akip on the bus 😴😵	I had the worst start to the day as cafe nero was shut and I couldn’t get a coffee 	1
Bbq sauce in alfredo kinda slaps I’m not joking		0
it’s so rude that i’m not at the beach right now	I wish I was at the beach right now 	1
"Can’t wait to get home take a big ass antihistamine and roll in some topical steroids.

Damn it, skin! What did I ever do to you?!?!"	My allergies are really acting up and I need to take some antihistamines and use ointment.	1
What a delight! I just love your creative interpretations of the facts!	Your interpretations are misleading.	1
do you guys ever turn the music down to try and figure out what that smell is		0
How delightful! I've lost my wallet again at the most stressful time possible.	Misplacing my wallet is very annoying.	1
Oh, I just love organizing events that no one will attend!	Event planning is frustrating when interest is low.	1
think I spent 8 hours playing animal crossing today		0
@playrust Rust is basically turning into Subnautica 2.		0
What a joy! To hear another speech about why we can't change!	I find the resistance to change frustrating.	1
How wonderful! Endless debates about trivial matters.	"These debates are not productive."" "	1
Vaccinated this morning. Not sure it's worked - still committed to Apple and no extra autism detected. Bloody science.	Vaccinated this morning. The vaccine did not contain a Microsoft chip, nor did it make me more autistic than I already am.	1
Wow, I can totally see how this system makes everything easier for us!	The new system complicates things.	1
@JessicaChung13 4) never take a first hour class		0
Oh great! Another reminder from my phone to pay my bills!	Bill reminders can feel overwhelming.	1
There is nothing wrong with showing concern when the next second in command of the free world has no respect for minorities #boycotthamilton		0
@favourite_uncle @town_chocolate @a_genz_elder @dickimaa @mikeduncan Civ 2 gave us Alpha Centauri, and that’s the pinnacle of the series there		0
our waitress at dinner tonight complimented my muscles so i guess you could say i’ve made it		0
virgos are leos in a vest	virgos act like leos	1
What joy it is to have someone else take my parking spot when I've waited ages!	Waiting for a parking space only to lose it is infuriating.	1
Has anyone written about the complexity of sick leave for the service/retail industry and how impossible it is not to screw over the other workers with it? does that make sense? I need an academic article on this with better words		0
y’all ever just sob in the vinbúðin?		0
Strong people have no need to bully. Bullies are never strong. Shouting and losing your temper are not signs of strength.		0
Hard to imagine a better start to Saturday than running through the forest listening to NRC’s “One Hour Run”, Coach Bennett’s love letter to running. Thanks Coach @bennettrun this is my favourite audio guided run so far 🙏 #nikehalfmarathontrainingplan #week12complete		0
Oh, how unique! Another coffee shop on every corner.	I feel the coffee shop market is oversaturated.	1
Oh, how great! Another team project that falls apart at the last moment!	The breakdown of team projects is frustrating.	1
Why do I have a doctorate and miss the restaurant industry SO MUCH		0
"I remember when I was a kid how I used to troll my dad. 
I’d be watching a film on sky movies and then when I knew he was in the other room I would say out loud ‘wow look at the tits on her’ 
He would come back in the room and nothing was there but he’d ask questions like…"		0
Spent all morning hiking a mountain and exploring waterfalls. Normal people take naps to recover. I hit the gym twice as hard! #goals		0
Oh good, let me just drop everything because this is the most important thing right now!	I cannot prioritize this over my other tasks.	1
As a woman I dont need hobbies dreams or goals cause I can spend all my time wondering why he didnt text back crying into a bag of doughnuts	Women have more going on in their life than their romantic relationships.	1
Oh joy, a traffic jam right when I need to be somewhere!	This traffic jam is very inconvenient.	1
why is the weather having a mid life crisis	“why is up with the weather at the moment” 	1
Wow, how refreshing! A never-ending discussion on theories that have no basis!	Talking about unfounded theories is unproductive.	1
What a wonderful time to suddenly crave an ice cream cone... when it's freezing outside!	Cravings can feel poorly timed.	1
How delightful! Another email chain about nothing important!	This email chain is unproductive.	1
Always glad to live in Kent 🙈🙈	It's absolutely going to be awful living In Kent after Brexit considering the issues with Lorries.	1
white ppl sure do love Himalayan pink sea salt		0
i’m now reading 4 books at once what could go wrong 🧡	"""i'm reading 4 books at once, let's see if i can actually finish them all"""	1
What a thrill it is to finally sit down with a book and find I forgot what it was about!	Forgetting books can make reading difficult.	1
What a wonderful experience it is to forget my homework right before class!	Forgetting assignments is stressful.	1
Wow! Your ability to sidestep responsibility is legendary!	Avoiding responsibility is problematic.	1
How thrilling! Another episode of 'Waiting for My Food.'	I do not enjoy waiting so long for my food.	1
How wonderful it is that my kid has taken to finger painting on the walls!	Creative kids can make a mess.	1
2021 is for your washer and dryer just becoming one appliance		0
I watched the first two episodes of American Horror Stories and holy shit it was so bad		0
What an incredible adventure it is to attempt assembling furniture without the instructions.	Building furniture without directions can be frustrating.	1
Wow, your confidence in giving advice is truly remarkable, considering the outcomes!	Your advice does not always turn out favorably.	1
How charming! A discussion on how to 'fix' everything!	Conversations seeking simple solutions are often complicated.	1
It would be nice if my body would let me sleep...	I wish my body would let me sleep.	1
the fact that “breaking: school shootings preventable” was an actual headline on nbc tonight is actually laughable	"the fact that ""breaking:school shootings preventable"" was an actual headline tonight is a sad commentary on our country"	1
Oh sure! Because who doesn't love being micromanaged?	Micromanagement is counterproductive.	1
if anyone sees me listening to tavern music or sea shanties on Spotify no you didn’t		0
Honestly, who needs a social life when you have Netflix?	I rely on Netflix more than socializing.	1
Oh goodie, my favorite time of year—the flu season!	Flu season always brings illness.	1
Oh fabulous! Another round of 'let's ignore the facts'!	Ignoring the facts is not advisable.	1
Yay for being locked out of your own  house because you forgot your key	I hate being locked out of my house when I forget my keys. 	1
I’m done being replaceable to my “friends”		0
Yay! Another late-night email from my boss just to 'touch base.'	Late-night work emails are frustrating.	1
Just switched to @octopus_energy 🐙 was with @BulbUK but there monthly payments go up and down like a seesaw and now they want even more money so.. #ByeBye		0
Yay! My laptop decided to freeze right as I was about to save my document.	Laptops freezing is incredibly inconvenient.	1
"But by far, my favorite part was a very drunk Rachel running over yelling ""I JUST KISSED A GIRL FOR MORE THAN THREE SECONDS!"""		0
Wow, your ability to ignore instructions is truly impressive!	You do not follow instructions well.	1
Oh marvelous! Another round of 'who's to blame?'	Blaming others is unproductive.	1
